<?xml version="1.0" encoding="UTF-8"?>

<!ELEMENT books (book+)>
<!ELEMENT book (isbn,name,price,author)>
<!ELEMENT isbn (#PCDATA)>
<!ELEMENT name (#PCDATA)>
<!ELEMENT price (#PCDATA)>
<!ELEMENT author ANY>

<!ATTLIST book id ID #REQUIRED>